{
  "schema_version": 1,
  "id": "ddr_013",
  "revision": 1,
  "title": "Give related resources one shared spine",
  "kind": "principle",
  "strength": "default",
  "statement": "Related resource types should share a layout, taxonomy, and component spine, varying only where type, ownership, or state creates a real difference.",
  "rationale": "Shared structure improves learnability and prevents sibling resource systems from drifting into separate products.",
  "guidance": {
    "prefer": [
      "Reuse the same information skeleton and shared components.",
      "Express only genuine type-specific differences."
    ],
    "avoid": [
      "Independent layouts, status vocabularies, and row structures for sibling resource types."
    ]
  },
  "classification": {
    "primary": "information.organization",
    "secondary": [
      "system.design-system",
      "product.architecture"
    ],
    "pattern_categories": [
      "Layout & composition",
      "Content & data"
    ]
  },
  "applicability": {
    "products": [
      "bb"
    ],
    "activities": [
      "architecture",
      "design",
      "critique",
      "implementation",
      "qa"
    ],
    "artifacts": [
      "workflow",
      "screen",
      "component"
    ],
    "surfaces": [
      "resource hubs",
      "overview rows",
      "detail pages"
    ],
    "contexts": [
      "skills",
      "plugins",
      "automations",
      "related resource types"
    ],
    "when": [
      "Several resource types live in one product hub or lifecycle."
    ],
    "not_when": [
      "A resource has a fundamentally different user job or lifecycle."
    ]
  },
  "exceptions": [],
  "relationships": [],
  "evidence": [
    {
      "id": "ev_013_01",
      "source": {
        "type": "published_summary",
        "store": "public-doctrine",
        "thread_id": "published-context-013",
        "source_keys": [
          "published-signal-047"
        ],
        "project_id": "published-scope-001"
      },
      "signal": "explicit_instruction",
      "stance": "supports",
      "observed_at": "2026-07-08",
      "summary": "Asked detail pages and resource rows to share taxonomy, layout, and components rather than invent parallel structures.",
      "excerpt": null,
      "content_sha256": "sha256:c75ba2c6b04fa86e4915058714795655a3aee4d2bf71c0dfb95895e2b33b1728",
      "doctrine_version_seen": "pre-doctrine",
      "episode_id": "external:published:episode-038",
      "episode_source_keys": [
        "published-span-047"
      ]
    },
    {
      "id": "ev_013_02",
      "source": {
        "type": "published_summary",
        "store": "public-doctrine",
        "thread_id": "published-context-006",
        "source_keys": [
          "published-signal-016"
        ],
        "project_id": "published-scope-001"
      },
      "signal": "explicit_instruction",
      "stance": "supports",
      "observed_at": "2026-07-13",
      "summary": "Requested a reusable detail-page taxonomy based on what each resource's metadata means.",
      "excerpt": null,
      "content_sha256": "sha256:ca997e1398431404c378d8c36d3518e2edbf334fa8a89654410363cb28b62d9f",
      "doctrine_version_seen": "pre-doctrine",
      "episode_id": "external:published:episode-015",
      "episode_source_keys": [
        "published-span-016"
      ]
    }
  ],
  "confidence": {
    "level": "high",
    "basis": {
      "explicit_user_signals": 2,
      "supporting_episodes": 2,
      "challenging_episodes": 0,
      "distinct_threads": 2,
      "distinct_projects": 1
    },
    "assessed_at": "2026-07-17",
    "note": "Bootstrapped from independent direct user episodes under the owner's request to mine durable design rules."
  },
  "lifecycle": {
    "status": "active",
    "created_at": "2026-07-17",
    "updated_at": "2026-07-17",
    "activated_at": "2026-07-17",
    "last_reviewed_at": "2026-07-17",
    "review_after": "2027-01-17",
    "approved_by": "owner-direct-history-bootstrap",
    "decision_note": "Activated only for the owner-requested initial bootstrap because repeated independent direct instructions or corrections establish this decision boundary."
  },
  "retrieval": {
    "keywords": [
      "automations",
      "detail",
      "hubs",
      "information",
      "organization",
      "overview",
      "pages",
      "plugins",
      "related",
      "resource",
      "rows",
      "skills",
      "types"
    ],
    "aliases": [],
    "positive_examples": [
      "Reuse the same information skeleton and shared components.",
      "Express only genuine type-specific differences."
    ],
    "negative_examples": [
      "Independent layouts, status vocabularies, and row structures for sibling resource types."
    ]
  },
  "verification": {
    "method": "visual_review",
    "checks": [
      "Do sibling resource pages share the same structural grammar?",
      "Are differences explained by real resource semantics?",
      "Can one shared component own the common behavior?"
    ]
  }
}
